{
  "managedBy": "trancendos-governance-v1",
  "schemaVersion": "1.0.0",
  "repositoryType": "service-module",
  "lifecycleCoverage": {
    "built": true,
    "implemented": true,
    "designed": true,
    "discovered": true,
    "maintained": true
  },
  "standards": {
    "modularDesign": {
      "required": true,
      "status": "in_place",
      "controls": [
        "bounded-context ownership",
        "contract-first interfaces",
        "versioned integration boundaries"
      ]
    },
    "fluidicDynamicEnvironment": {
      "required": true,
      "status": "in_place",
      "controls": [
        "feature flags",
        "blue-green or canary rollout",
        "runtime configuration controls"
      ]
    },
    "adaptiveUxUi": {
      "required": true,
      "status": "planned",
      "controls": [
        "responsive breakpoints",
        "accessibility checks",
        "feedback telemetry loop"
      ]
    },
    "selfLearningLivingDocumentation": {
      "required": true,
      "status": "in_place",
      "controls": [
        "automated architecture reports",
        "change-linked decision records",
        "scheduled documentation validation"
      ]
    },
    "zeroCostOptimization": {
      "required": true,
      "status": "in_place",
      "controls": [
        "free-tier-first design",
        "cost guardrails",
        "monthly usage review"
      ]
    },
    "legalEthicalGlobalCompliance": {
      "required": true,
      "status": "in_place",
      "controls": [
        "jurisdiction-aware data handling",
        "license and policy compliance checks",
        "supplier legal document review"
      ]
    }
  }
}
